subjID,TrialNum,List,BlockOrder,ItemNum,Condition,TrialType,SentenceType,Sentence,Response,A_rating,B_rating
17483393511275489231,1,8,4,67,Speaker_Error,exposure,swap,The playwright selected the resemblance because of his understudy to the lead actor.,hi hi
17483393511275489231,2,8,4,57,Speaker_Error,exposure,insertion,A legislator lied to the consultant about for a new bill.,
17483393511275489231,3,8,4,61,Speaker_Error,exposure,insertion,The archivist found a document dating back to was the Nixon administration.,
17483393511275489231,4,8,4,52,Speaker_Error,exposure,deletion,The spy monitored a baroness several months.,
17483393511275489231,5,8,4,53,Speaker_Error,exposure,deletion,The terrorist assassinated the newsman cold blood.,
17483393511275489231,6,8,4,60,Speaker_Error,exposure,insertion,The acrobat respected after the ballerina because she went to Juilliard.,
17483393511275489231,7,8,4,80,Speaker_Error,filler,filler,The charity built a house for the hurricane victim.,
17483393511275489231,8,8,4,90,Speaker_Error,filler,filler,The apple was placed on the teacher's desk.,
17483393511275489231,9,8,4,77,Speaker_Error,filler,filler,The man was nudged by the woman.,
17483393511275489231,10,8,4,83,Speaker_Error,filler,filler,The boyfriend obtained some concert tickets for his girlfriend.,
17483393511275489231,11,8,4,69,Speaker_Error,exposure,deletion,The spokesman toasted a muffin for the agent the early morning appointment.,
17483393511275489231,12,8,4,79,Speaker_Error,filler,filler,A magnificent diamond sparkled on the prince's finger.,
17483393511275489231,13,8,4,70,Speaker_Error,exposure,swap,The advisee opened a file for the visitor some with trepidation.,
17483393511275489231,14,8,4,66,Speaker_Error,exposure,swap,The preacher irritated a parishioner because she used was to shorter sermons.,
17483393511275489231,15,8,4,51,Speaker_Error,exposure,deletion,The dealer shuffled deck before distributing the cards.,
17483393511275489231,16,8,4,59,Speaker_Error,exposure,insertion,The pianist met with a beautician to about prepare for her recital.,
17483393511275489231,17,8,4,78,Speaker_Error,filler,filler,The grocery store didn't have any more whole wheat bread in stock.,
17483393511275489231,18,8,4,98,Speaker_Error,filler,filler,A ghost appeared above the bed.,
17483393511275489231,19,8,4,86,Speaker_Error,filler,filler,The soccer mom was offended by the journalist because he asked rude questions.,
17483393511275489231,20,8,4,92,Speaker_Error,filler,filler,The bartender poured a drink for the customer.,
17483393511275489231,21,8,4,55,Speaker_Error,exposure,deletion,An analyst angered the economist after he interrupted phone conference five times.,
17483393511275489231,22,8,4,56,Speaker_Error,exposure,deletion,The intern begged a programmer to edit the program because it due the next day.,
17483393511275489231,23,8,4,62,Speaker_Error,exposure,insertion,The sculptor brought a shell from with the ocean floor.,
17483393511275489231,24,8,4,72,Speaker_Error,filler,filler,The waitress fixed a sandwich for the customer.,
17483393511275489231,25,8,4,65,Speaker_Error,exposure,swap,The robot killed a scientist from escaping before the laboratory.,
17483393511275489231,26,8,4,88,Speaker_Error,filler,filler,The sergeant assigned a locker to the private after the meeting.,
17483393511275489231,27,8,4,64,Speaker_Error,exposure,swap,The defendant misled a juryman when she worked that she said for the government.,
17483393511275489231,28,8,4,58,Speaker_Error,exposure,insertion,The insurer paid the victim because while his car had been destroyed.,
17483393511275489231,29,8,4,73,Speaker_Error,filler,filler,The man ordered some champagne for his girlfriend.,
17483393511275489231,30,8,4,68,Speaker_Error,exposure,swap,The status conducted an inquiry into the professor of the file.,
17483393511275489231,31,8,4,82,Speaker_Error,filler,filler,The architect was commissioned by the large company.,
17483393511275489231,32,8,4,63,Speaker_Error,exposure,swap,The cameraman was paid to follow a bridesmaid down the camera with his aisle.,
17483393511275489231,33,8,4,54,Speaker_Error,exposure,deletion,The witch was hanged an executioner promptly at dawn.,
17483393511275489231,34,8,4,97,Speaker_Error,filler,filler,The submarine captain accepted the mission.,
17483393511275489231,35,8,4,71,Speaker_Error,filler,filler,The woman saved a seat for her husband.,
17483393511275489231,36,8,4,48,Speaker_noError,exposure,swap,The toddler hugged a teddybear because he was scared.,
17483393511275489231,37,8,4,110,Speaker_noError,filler,filler,The name was engraved on the ring.,
17483393511275489231,38,8,4,118,Speaker_noError,filler,filler,The lawyer was insulted by the judge.,
17483393511275489231,39,8,4,122,Speaker_noError,filler,filler,The TA was criticized by the professor.,
17483393511275489231,40,8,4,36,Speaker_noError,exposure,deletion,The rioter stapled the sign to a bulletin board in the corridor.,
17483393511275489231,41,8,4,47,Speaker_noError,exposure,swap,The Vikings raided a village in search of the warrior.,
17483393511275489231,42,8,4,128,Speaker_noError,filler,filler,The girl was pushed by the boy.,
17483393511275489231,43,8,4,41,Speaker_noError,exposure,insertion,The presenter was criticized by a legislator because of his speech impediment.,
17483393511275489231,44,8,4,50,Speaker_noError,exposure,swap,The runner filled a bottle with cold tap water.,
17483393511275489231,45,8,4,107,Speaker_noError,filler,filler,The apprentice fetched a hammer for the carpenter.,ho ho
17483393511275489231,46,8,4,33,Speaker_noError,exposure,deletion,The trainer filled a bag with ice for the injured client.,
17483393511275489231,47,8,4,39,Speaker_noError,exposure,insertion,A socialite was greeted by the butler with a plate of caviar.,
17483393511275489231,48,8,4,38,Speaker_noError,exposure,insertion,The surgeon called for a nurse to assist him with the operation.,
17483393511275489231,49,8,4,45,Speaker_noError,exposure,swap,The colonel was knighted by the queen because of his loyalty.,
17483393511275489231,50,8,4,121,Speaker_noError,filler,filler,The runner trained for months before the marathon.,
17483393511275489231,51,8,4,102,Speaker_noError,filler,filler,Some of the woman's cats were scared of dogs but most of them weren't.,
17483393511275489231,52,8,4,42,Speaker_noError,exposure,insertion,A bystander was rescued by the fireman in the nick of time.,
17483393511275489231,53,8,4,31,Speaker_noError,exposure,deletion,The pirate stole the booty from an officer.,
17483393511275489231,54,8,4,130,Speaker_noError,filler,filler,The bank robber spent thirty minutes cracking the code for the safe.,
17483393511275489231,55,8,4,32,Speaker_noError,exposure,deletion,The supplier described a scenario for the class after explaining basic concepts.,
17483393511275489231,56,8,4,40,Speaker_noError,exposure,insertion,The performer lifted the acrobat onto her shoulders gracefully.,
17483393511275489231,57,8,4,37,Speaker_noError,exposure,deletion,The beekeeper selected a honeycomb carefully from a hive of swarming bees.,
17483393511275489231,58,8,4,126,Speaker_noError,filler,filler,The dog trainer taught the puppy to roll over.,
17483393511275489231,59,8,4,44,Speaker_noError,exposure,insertion,The translator found a car for the ambassador because he could not speak Lebanese.,
17483393511275489231,60,8,4,34,Speaker_noError,exposure,deletion,The commissioner wrote a report for the chairman.,
17483393511275489231,61,8,4,120,Speaker_noError,filler,filler,The secretary ordered some office supplies for the boss.,
17483393511275489231,62,8,4,46,Speaker_noError,exposure,swap,The principal commended a parent for her ability to motivate her child.,
17483393511275489231,63,8,4,115,Speaker_noError,filler,filler,The father bought a bicycle for his son.,
17483393511275489231,64,8,4,49,Speaker_noError,exposure,swap,The choreographer found a film starring the lead in the musical.,
17483393511275489231,65,8,4,104,Speaker_noError,filler,filler,The grandmother made a quilt for her granddaughter.,
17483393511275489231,66,8,4,43,Speaker_noError,exposure,insertion,The trucker ordered a bartender to bring him a beer.,
17483393511275489231,67,8,4,114,Speaker_noError,filler,filler,The seamstress made a dress for her client.,
17483393511275489231,68,8,4,35,Speaker_noError,exposure,deletion,The paramedic helped an invalid into the brick building.,
17483393511275489231,69,8,4,123,Speaker_noError,filler,filler,The athlete was treated by a nurse who had been listening to music.,
17483393511275489231,70,8,4,105,Speaker_noError,filler,filler,The travel agent reserved a flight for the businessman.,
17483393511275489231,71,8,4,129,Speaker_noError,filler,filler,The defendant's name was written on the check.,
17483393511275489231,72,8,4,117,Speaker_noError,filler,filler,The ballet instructor encouraged her students to practice more.,
17483393511275489231,73,8,4,1,Speaker_noError,test,deletion,The uncle sold the truck the father.,
17483393511275489231,74,8,4,14,Speaker_noError,test,swap,The saw sharpened the father.,
17483393511275489231,75,8,4,9,Speaker_noError,test,insertion,The judge gave the athlete to the prize.,
17483393511275489231,76,8,4,112,Speaker_noError,filler,filler,The baby crawled into the hallway.,
17483393511275489231,77,8,4,11,Speaker_noError,test,swap,The message read the assistant.,
17483393511275489231,78,8,4,15,Speaker_noError,test,swap,The blanket folded the daughter.,
17483393511275489231,79,8,4,7,Speaker_noError,test,insertion,The host tossed the contestant to the microphone.,
17483393511275489231,80,8,4,4,Speaker_noError,test,deletion,The sculpture shattered the fall.,
17483393511275489231,81,8,4,106,Speaker_noError,filler,filler,A cat jumped onto the table.,
17483393511275489231,82,8,4,6,Speaker_noError,test,insertion,The construction noise worsened from the man's hearing.,
17483393511275489231,83,8,4,8,Speaker_noError,test,insertion,The long drought deteriorated from the soil.,
17483393511275489231,84,8,4,109,Speaker_noError,filler,filler,Some treasure was found in the cave.,
17483393511275489231,85,8,4,108,Speaker_noError,filler,filler,The painting hung on the bedroom wall.,
17483393511275489231,86,8,4,111,Speaker_noError,filler,filler,The cheerleader was treated by a doctor who had been watching the game.,
17483393511275489231,87,8,4,125,Speaker_noError,filler,filler,The receptionist saved some cake for her co-worker.,
17483393511275489231,88,8,4,124,Speaker_noError,filler,filler,The marathoner ran into the stadium.,
17483393511275489231,89,8,4,13,Speaker_noError,test,swap,The oven cleaned the grandmother.,
17483393511275489231,90,8,4,127,Speaker_noError,filler,filler,The astronaut accepted the mission.,
17483393511275489231,91,8,4,5,Speaker_noError,test,deletion,The janitor lent the mop the teacher.,
17483393511275489231,92,8,4,10,Speaker_noError,test,insertion,The chemotherapy shrank from the tumor.,
17483393511275489231,93,8,4,101,Speaker_noError,filler,filler,The helicopter hovered over the water.,
17483393511275489231,94,8,4,3,Speaker_noError,test,deletion,The player benefited the intense practice.,
17483393511275489231,95,8,4,119,Speaker_noError,filler,filler,A flowering plant is on the window sill.,
17483393511275489231,96,8,4,12,Speaker_noError,test,swap,The bat swung the player.,
17483393511275489231,97,8,4,116,Speaker_noError,filler,filler,The hiker was rescued by a ranger who had been on patrol.,
17483393511275489231,98,8,4,113,Speaker_noError,filler,filler,The train arrived at the station.,
17483393511275489231,99,8,4,2,Speaker_noError,test,deletion,The scuba instructor rented the equipment the tourist.,
17483393511275489231,100,8,4,103,Speaker_noError,filler,filler,The first-graders liked their teacher because she used games to teach them how to read.,
17483393511275489231,101,8,4,75,Speaker_Error,filler,filler,The journalist was ignored by the politician at the press conference.,
17483393511275489231,102,8,4,16,Speaker_Error,test,deletion,The quarterback passed the ball the receiver.,
17483393511275489231,103,8,4,26,Speaker_Error,test,swap,The watch bought the plumber.,
17483393511275489231,104,8,4,94,Speaker_Error,filler,filler,The mobile was hanging from the ceiling.,
17483393511275489231,105,8,4,24,Speaker_Error,test,insertion,The hot stove melted from the plastic handle.,
17483393511275489231,106,8,4,25,Speaker_Error,test,insertion,The daughter passed the mother to the bowl.,
17483393511275489231,107,8,4,28,Speaker_Error,test,swap,The train boarded the granddaughter.,
17483393511275489231,108,8,4,93,Speaker_Error,filler,filler,The moose's head was mounted on the wall.,
17483393511275489231,109,8,4,23,Speaker_Error,test,insertion,The extra time benefited from the child with a learning disability.,
17483393511275489231,110,8,4,84,Speaker_Error,filler,filler,The cook baked a cake for Lucy.,
17483393511275489231,111,8,4,96,Speaker_Error,filler,filler,An old woman lives in the woods.,
17483393511275489231,112,8,4,20,Speaker_Error,test,deletion,The corrupt politicians profited the bribes.,
17483393511275489231,113,8,4,19,Speaker_Error,test,deletion,The millionaire profited the tax reduction.,
17483393511275489231,114,8,4,89,Speaker_Error,filler,filler,The jewelry-maker was commissioned by the millionaire.,
17483393511275489231,115,8,4,76,Speaker_Error,filler,filler,The small plant grew into a huge tree.,
17483393511275489231,116,8,4,17,Speaker_Error,test,deletion,The patient's condition deteriorated the new medicine.,
17483393511275489231,117,8,4,27,Speaker_Error,test,swap,The ball kicked the girl.,
17483393511275489231,118,8,4,21,Speaker_Error,test,insertion,The earthquake shattered from the house.,he he 
17483393511275489231,119,8,4,81,Speaker_Error,filler,filler,The church built a shelter for the homeless.,
17483393511275489231,120,8,4,95,Speaker_Error,filler,filler,The coach encouraged the team to score in the last quarter.,
17483393511275489231,121,8,4,30,Speaker_Error,test,swap,The table set the mother.,
17483393511275489231,122,8,4,91,Speaker_Error,filler,filler,The nurse poured some water for the old man.,
17483393511275489231,123,8,4,87,Speaker_Error,filler,filler,The lab-assistant fetched a test-tube for the scientist.,
17483393511275489231,124,8,4,99,Speaker_Error,filler,filler,The student spent all night studying and aced the test.,
17483393511275489231,125,8,4,18,Speaker_Error,test,deletion,The actor handed the script the director.,
17483393511275489231,126,8,4,100,Speaker_Error,filler,filler,The chef cleaned the ladle before he stirred the soup.,
17483393511275489231,127,8,4,29,Speaker_Error,test,swap,The stamp licked the secretary.,
17483393511275489231,128,8,4,74,Speaker_Error,filler,filler,The woman was held by the man.,
17483393511275489231,129,8,4,22,Speaker_Error,test,insertion,The bad lighting deteriorated from the woman's eyesight.,
17483393511275489231,130,8,4,85,Speaker_Error,filler,filler,The dental technician accepted the job at the new office even though it didn't pay much.,
